Index,Label,Sentence
3103,5,용인 자연농원에 자동차경주장 생긴다
3104,5,내 호주머니에 있어."
3105,5,그녀는 관리실에 전화를 걸었다.
3106,5,"지금 지방에 있습니다."
3107,5,"옆집 가게에 새로 주인이 바뀌었어요."
3108,5,그러니 너무 안에 갇혀 있다.
3109,5,다른 공업들은 실제로 어디에 왜 있을까.
3110,5,한 달 간 병원에 있어야 한대."
3111,5,참 여산에도 들를 거니?"
3112,5,그곳에는 김병곤 형도 남아 있었다.
3113,5,첫째 어머니는 불 속에 떡을 집어넣는다.
3114,5,내일은 거기에 가봐야 해."
3115,5,끄느름한 하늘이 창 너머에 있었다.
3116,5,맞은편 관상대 골목에도 사람이 빽빽이 찼다.
3117,5,"이곳에는 어쩐 일로…."
3118,5,사상 앞에는 형제도 이웃도 없었다.
3119,5,그 길목에 말라르메가 있었다.
3120,5,인사동 곳곳에 위치한 전시장을 살펴보자.
3121,5,의자에 화가가 앉아 있었다.
3122,5,가 코에 코피가 쏟아졌다.
3123,5,거리도 건물도 거기 그 자리에 그대로 있다.
3124,5,또 비변사록에는 더 자세히 나옵니다.
3125,5,팬에 버터를 두른다.
3126,5,한 티끌 속에 십방세계가 들어 있고
3127,5,어느 한 귀퉁이에는 내 소설도 있다.
3128,5,그 여자의 눈에 눈물이 고였다.
3129,5,침대에 누운 채.
3130,5,땅 위에 첫서리가 내린 날이었다.
3131,5,식구들이 모두 항아리 둘레에 모였습니다.
3132,5,무대에 서는 것은 선수들이다.
3133,5,셋째 시간 교문에 은철이가 나타났다.
3134,5,뒤에는 아무도 없었다.
3135,5,그만큼 여성지에는 매춘여성 기사가 많다.
3136,5,호찌민에는 한국산 차량들이 많다.
3137,5,포항 대포집에는 병석이가 없었다.
3138,5,"그 산에는 한기가 흘러요.
3139,5,갑산군 함경 남도 북동부에 자리잡고 있는 군.
3140,5,"나라 들에는 친구가 없다.
3141,5,얼굴에 흥분의 미소가 가라앉지 않는다.
3142,5,군산시 전라북도 북서부에 있는 항구 도시.
3143,5,바이칼호 러시아 동시베리아 남부에 있는 호수.
3144,5,시골에 아이 울음소리가 거의 없다.
3145,5,우리 주위에는 이런 사람도 있다.
3146,5,정부의 고민도 여기에 있다.
3147,5,춘기의 어깨에는 한껏 힘이 들어갔다.
3148,5,구례군 전라남도 북동쪽 끝에 자리잡고 있는 군.
3149,5,그는 그녀 앞에 섰다.
3150,5,그러나 실제 비엔나에는 없는 커피.
3151,5,"주인은 김포에 살아.
3152,5,강서구 화곡동에 사는 심남주 씨의 글입니다.
3153,5,가로변에 서울 시청과 덕수궁이 있다.
3154,5,도시 곳곳에 그의 동상과 사진이 있습니다.
3155,5,⊙입장 거봉 포도 축제에 오세요 !양경숙
3156,5,마침내 세상의 중심에 섰다.
3157,5,소주병은 방에 지천으로 널려 있었으니까.
3158,5,그것이 그대로 못 속에 가라앉은 모양이다.
3159,5,그러나 여기에도 문제는 있다.
3160,5,서울 송파구 거여동에 사는 신용재 씨(36.승일전기
3161,5,한국에 초청을 해보라고 말야."
3162,5,"읍에 고치실 켜는 공장입니다."
3163,5,법무관으로 해군에 몸담고 있다.
3164,5,"고향엔 이제 아무도 없어.
3165,5,"이 통에 공을 넣어보자.
3166,5,[나두 이 집에 사는 사람이다.
3167,5,내 호주머니에는 열쇠가 있었다.
3168,5,훈아는 맥없이 살평상 위에 걸터앉았다.
3169,5,우리 시조의 병폐는 바로 여기에 있다.
3170,5,이미 오래 전 이곳에 내려졌던 그때부터.
3171,5,그러나 마음 한쪽에 도사려있는 불안감.
3172,5,세상에 이런 인심이 있는가?
3173,5,방송가에 한바탕 선글라스 선풍이 불었다.
3174,5,"왼쪽 유두 위쪽에 뭐가 생겼대.
3175,5,라디에이터에 걸터앉은 사내가 말했다.
3176,5,진실은 이면에 숨어 있게 마련이다.
3177,5,머리에 이가 있다."
3178,5,그러나 배는 거기에 없었다.
3179,5,입가에 연신 웃음이 번졌다.
3180,5,세상에는 그런 부류의 사람들이 있다구.
3181,5,성의 한편에는 시계 박물관이 있었다.
3182,5,이곳에는 숙희네 집이 있었다.
3183,5,내가 왜 이 세상에 태어났을까?
3184,5,임존성엘 못 가겠단 말이야.
3185,5,가슴에 잉걸불이 지펴졌다.
3186,5,튀니지 북부 아프리카의 지중해 연안 중앙부에 있는 공화국.
3187,5,우리는 구석자리에 마주앉았다.
3188,5,쭉 뻗는 공 센타 앞에 안터!"
3189,5,반야원에 모십시다.
3190,5,그리고 미간에 힘이 들어갔다.
3191,5,모든 동물은 물 속에 알을 낳는다.
3192,5,나는 회사에 전화를 걸었다.
3193,5,구미시 경상북도 서부의 중앙에 있는 시.
3194,5,산너머 이편에 있는 단배에서도
3195,5,형기의 집에 일이 터진 것이다.
3196,5,"후배놈 하나가 병원에 있어.
3197,5,원두막에는 나와 누나도 잤다.
3198,5,그가 인천에나 있는지?
3199,5,외국은행들의 걱정은 바로 여기에 있다.
3200,5,"내 밑에 있어볼래?"
3201,5,여자는 손에 꽃을 들고 있었다.
3202,5,그곳에 순미가 있었다.
3203,5,하지만 영화는 언제나 내 곁에 있었다.
3204,5,야 사람 위에 사람 없는 벱이다.
3205,5,코끝에 바다 냄새가 따라다녔지.
3206,5,JYP에는 연습생이 21명 있다.
3207,5,제주도 울릉도 및 남해안 도서지역에 흔하다.
3208,5,아버지는 집에 안 계셨다.
3209,5,본사는 서초동에 있었다.
3210,5,이제 다시 방 안에는 침묵이 흘렀다.
3211,5,빌딩이 숲같이 양쪽에 서 있었다.
3212,5,그 뿌리에는(소름이 끼치지만!)
3213,5,거기에 또 이런 원칙이 있지.
3214,5,섬진강의 새끼강 보성강 유역에 주암호가 있다.
3215,5,요즈음은 각종 정보가 인터넷에 들어있다.
3216,5,"산에 함부로 오는 게 아니지요."
3217,5,(송곳을 아랫목에 앉힌다.)
3218,5,거울 속에는 본디 아무것도 없거든."
3219,5,제가 남한산국민학교에 교감으로 있을 땝니다.
3220,5,그리고 도로에 꼼짝없이 서 있던 차량들.
3221,5,상 위에는 과일도 있었다.
3222,5,얼굴에 분칠을 한 것도 아닙니다.
3223,5,이 세상에는 비정상이 왜 이리 많은가.
3224,5,「안에 계시죠?」
3225,5,"세상에 이런 일도 있습니까?"
3226,5,포천군 신북면에 사는 서미순씨의 글입니다.
3227,5,티린스 미케네 그리스의 펠로폰네소스 반도에 있는 유적지.
3228,5,거기에는 한 여자가 끼여 있었다.
3229,5,"보험에는 들어 있는 모양이고.
3230,5,"이 근처에 구했거든요."
3231,5,돌에도 피가 돈다.
3232,5,스와질랜드 남아프리카 남동부에 있는 입헌 군주국.
3233,5,"유한동산에는 절대로 울타리를 치지 마라.
3234,5,재석이도 그 옆에 넓죽 엎드렸다.
3235,5,밖에 나와 지구봉을 탔다.
3236,5,"이년 이 천하에 쥑일 년.
3237,5,기름은 양조장 헛간에 있었다.
3238,5,── 이미 여기에 와 계십니다.
3239,5,뒷주머니에 지갑이 보인다.
3240,5,그러나 놈들은 그곳에 없었다.
3241,5,제자리의 땅 밑에 있다.
3242,5,벌교에는 비가 오지 않는다.
3243,5,레스파아네 부인의 모습은 이 방에 없었다.
3244,5,그녀는 컴퓨터 모니터에 앉았다.
3245,5,"세상에 이런 고약한 놈이 있나.
3246,5,권상무의 그늘에는 결코 들어가지 않는다.
3247,5,특별사동에 아침해가 떠오르고 있었다.
3248,5,나를 물 속에 집어넣었다.
3249,5,물웅덩이에도 빠졌다.
3250,5,집 안에 누가 있는가?
3251,5,이 쪽 길에는 갈밭도 없다.
3252,5,태안군 충청남도 북서쪽 황해안에 자리잡은 군.
3253,5,스크린 앞에 손수건 한 장만 남겨놓고.
3254,5,단 배에 여유가 있으면 말야….
3255,5,잣죽 위에는 대추채를 얹는다.
3256,5,나는 한국에 사는 아무개야.
3257,5,밥상에 한 마리 놓아 드렸지.
3258,5,고아 이곳에는 그런 아이들이 있습니다.
3259,5,황성 옛터에 밤이 되니 월색만 고요히……
3260,5,그쪽에는 얼씬도 안했어."
3261,5,그러나 저 뒤에 숨은 진실은 무엇일까?
3262,5,거기에는 불만이 있습니다.
3263,5,그곳에는 아무런 놀이기구도 없습니다.
3264,5,길에 널린 게 여자야.
3265,5,갑자기 무대에 불이 켜졌다.
3266,5,저의 방에 왜 커피가 없겠어요?
3267,5,안에는 으례껏 몽둥이가 놓여 있다.
3268,5,입가엔 득의만만한 미소가 번졌다.
3269,5,순대국집 화장실은 가게 밖에 있었다.
3270,5,이 복덕방에는 흔히 세 늙은이가 모이었다.
3271,5,세희는 어디에 있는 걸까?
3272,5,서울에 사촌동생이 있었다.
3273,5,아이들의 노래가사가 액정화면에 뜬다.
3274,5,그리고 다시 난로 옆에 앉았다.
3275,5,셋째 자아가 신비의 영역에 있다.
3276,5,청어는 북유럽 해안에 매우 많다.
3277,5,호치민 루트에 있긴 했지만."
3278,5,맨 앞 줄에 숙희의 모습이 보였다.
3279,5,이내 면소가 있는 마을에 도착했다.
3280,5,평창군 강원도 남부 중앙에 자리잡고 있는 군.
3281,5,세상에 이럴 수가.
3282,5,여기에는 주사파의 득세도 한몫 했다.
3283,5,통북투 아프리카 북서부의 말리 중앙부에 있는 도시.
3284,5,아낙의 얼굴에 핏기가 가셨다.
3285,5,어디에도 내 나라는 없다.
3286,5,무지개 마을이라고 오리 역에 있어.
3287,5,거기 한 나무에 기어올랐다.
3288,5,사냥꾼은 거미 구멍에 들어가지 못한다.
3289,5,구강염 구순 구각염 구강의 점막에 생기는 염증.
3290,5,동승은 홈통 밑에 다관을 받쳤다.
3291,5,숙소는 거의 해안가에 있었다.
3292,5,간신히 저 쪽 둑에 닿았다.
3293,5,어느새 그녀는 소파에 앉아 있었다.
3294,5,그러나 어디에도 공동묘지는 보이지 않았다.
3295,5,저의 방에는 담배가 있거든요.
3296,5,그 앞에 혜연은 무릎을 꿇었다.
3297,5,아버지는 지금 집에 계십니까?”라고
3298,5,그는 무진에 어울리는 사람이다.
3299,5,페레스트로이카는 도대체 어디에 있는 것일까.
3300,5,우리 학과에도 여학생이 많다.
3301,5,그는 두 손을 머리칼 속에 파묻었다.
3302,5,그 지점에 털이 많다는 뜻이다.
3303,5,민수 이불은 아랫목에 따로 깔렸습니다.
3304,5,그곳에는 책이 산다.
3305,5,신사는 학교 뒷산 아래에 있었다.
3306,5,뻬쩨르부르그에는 내 친구가 있었다.
3307,5,맥도날드 앞에 셔틀버스 정류장이 있다.
3308,5,겉으로만 착한 척 속에는 마귀.
3309,5,경지의 입가에 미소가 번졌다.
3310,5,공회당에 대추벌 사람이 삼백명 가까이 모여들었다.
3311,5,거기에 그대로 나와 있었어.
3312,5,늙은이는 곰방대를 입에 물었다.
3313,5,"도는 어디에 있는가?"
3314,5,군대에 가기 전이었다.
3315,5,우리 조국에 영광이 있기를!
3316,5,나는 거기에서도 갈증에 시달렸다.
3317,5,'황성 옛터에 밤이 되니 월색만 고요히'
3318,5,할머니 부엌 아궁이에 묻어 뒀다.
3319,5,"저 동네 꼭대기에 사신다면서요?"
3320,5,솔바늘 끝에 매달려 마중하는 눈빛.
3321,5,포도나무에 꼬이던 벌레는 흰불나방이었다.
3322,5,신랑 신부가 목사 앞에 섰다.
3323,5,바닥에 밀짚 이엉도 폈다.
3324,5,그러나 결코 가족 위에 군림하진 않는다.
3325,5,만기 형은 자리에 누우면서 말했다.
3326,5,서울에 눈이 내렸다.
3327,5,민들레 근처에 간 건 사실이었다.
3328,5,그녀의 등뒤에 보이는 자줏빛 소파.
3329,5,그 때 할아버지는 얼굴에 미소를 지었습니다.
3330,5,"3번 홈에 대기하고 있습니다."
3331,5,공릉동 서울공대 앞에 하숙을 잡았다.
3332,5,그런데 팔당호 하류에도 물은 흐른다.
3333,5,그러나 그곳에 영순이는 없었다.
3334,5,"노래의 날개 위에 그대를 태우고.
3335,5,순간적으로 아랫배에 힘이 들어갔다.
3336,5,"아버님은 댁에 계세요?"
3337,5,광명시 철산동에 사는 최은경씨의 글입니다.
3338,5,교실에 들어가서도 마찬가지였다.
3339,5,브라질 남아메리카 대륙 동부에 있는 나라.
3340,5,나는 갑자기 가슴에 동통을 느꼈다.
3341,5,나는 관사에 다시 살고 싶습니다.
3342,5,오지 마 한국에는!"
3343,5,땅에도 기맥이 있다.
3344,5,도는 바로 우리들 가까이에 있습니다.
3345,5,전주와 남원에도 있다.
3346,5,쟝은 지금 빈에 없습니다.
3347,5,옥점이는 눈앞에 선비를 그려보았다.
3348,5,방에 누워 있었다.
3349,5,영의 나라에 길이 열리려 한다.
3350,5,어린이 나라에 세 가지 예술이 있다.
3351,5,또 언젠가 미장원에 들렀을 때였다.
3352,5,철창에 매달리란 말야.
3353,5,나는 언제나 거기에 있었다.
3354,5,서대문밖 대조동에 살 때의 일이다.
3355,5,나는 도봉구청 정문 앞에 산다.
3356,5,옷장 안에는 저고리도 없다.
3357,5,끝섬의 절벽 끝에 올라선 두 사람.
3358,5,비행기 밖에는 비바람이 몰아치고 있었다.
3359,5,이 여자가 도대체 어디에 있는 거야?
3360,5,버스 정류장 옆의 다방에 있었다.
3361,5,신혼초부터 나를 시댁에 자꾸 보내더라구.
3362,5,그날도 그곳엘 들렀습니다.
3363,5,그때는 엄마도 옆에 있었습니다.
3364,5,카페에는 경주 혼자 있지 않았다.
3365,5,둘은 어느새 풀장에 나와 있었다.
3366,5,그 속에 믿음(信)이 있다.
3367,5,청년은 아랫배에 힘을 주었다.
3368,5,저고리는 속적삼 위에 하나밖에 안 입었다.
3369,5,그의 눈에 얼핏 의혹이 스쳤다.
3370,5,…… 이런 걱정도 머리에 떠오른다.
3371,5,태릉에는 배나무가 많다.
3372,5,집에 전화가 안 되는구나.
3373,5,애인 앞에 선 당신!
3374,5,그것들이 땅바닥에 질펀하게 흩어졌다.
3375,5,대부분의 농토는 마을 앞에 있다.
3376,5,성태는 뒤쪽에 잠자코 서 있었다.
3377,5,무슨 예감처럼 찻집에 노래가 다시 흘렀다.
3378,5,또 일월산에는 고산족들이 산다.
3379,5,이상하게도 자꾸만 귓가에 맴돌았지.
3380,5,읍에 고성문화사랑모임을 만들었다.
3381,5,아래 느티나무에도 뱀이 살고 있었다.
3382,5,그 구멍의 뒤에는 무엇이 있을까?
3383,5,대한민국-이 나라에 이런 교사가 얼마나 될까?
3384,5,너는 독 안에 든 쥐다.
3385,5,"바깥에 있을 때보다 건강해요.
3386,5,"그놈 집에 있지요?"
3387,5,지금 모든 씨들은 땅속에 숨어 있다.
3388,5,바위 주변에 정자터와 집터 흔적이 있다.
3389,5,"요 너머 막집에 사는 아이요.
3390,5,"한국외국어대학교에 월남어과가 있어요.
3391,5,아버지는 시체실에 누워 계셨다.
3392,5,동준도 그 속에 파묻혔다.
3393,5,"그 구멍에 눈을 대어라."
3394,5,"문씨 집안에 효자 나셨구나."
3395,5,차에 기름도 넣어야 하고요."
3396,5,상주군 경상북도 서쪽 끝에 자리잡고 있는 군.
3397,5,이 장모가 화장실에 들어서더니
3398,5,강에는 배 하나 지나가지 않는다.
3399,5,"이 땅에 우익은 죽었는가!"
3400,5,우리 동네에 생여가 나갔다.
3401,5,"축구장에 관중들을 좀 모읍시다.
3402,5,일본에는 군신이라는 것도 있다.
3403,5,그래서 교회에 가는 것은 포기했다.
3404,5,창밖에 비가 내렸다.
3405,5,애벌레는 먹이 한가운데에 가로뉘어 있다.
3406,5,나는 그 자리에 주저앉고 말았다.
3407,5,호젓한 해골 마을에 뉘엿뉘엿 노을이 진다.
3408,5,위노나는 식탁 밑에 쭈그리고 있었다.
3409,5,학교에 잘 나가는지도요."
3410,5,강동구 서울 특별시 남동부 한강 남쪽에 있는 구.
3411,5,우리 외가는 개성에 있다.
3412,5,거기에 빨래는 없다.
3413,5,암컷은 옆구리에 암갈색 무늬가 있다.
3414,5,방 열쇠가 보관함 속에 그대로 있었다.
3415,5,두 선생님을 우리 학교에 달라고.
3416,5,백통테 안경은 기선 갑판 위에 올라섰다.
3417,5,엄마는 저고리를 장롱 바닥에 넣었습니다.
3418,5,양복바지에 원하는 스커트의 길이를 표시한다.
3419,5,두 척의 배가 바다에 떠 있습니다.
3420,5,너는 컴퓨터 안에 있다.
3421,5,이웃집에 살아?
3422,5,── 언제부터 이 방에 들어왔어요?
3423,5,강 양편에는 물풀들이 하느작거립니다.
3424,5,"마루에 가둬.
3425,5,산에는 꽃 피네.†
3426,5,일본에 어느 만담가가 있었다.
3427,5,산 밑에는 집이 있었다.
3428,5,그러나 옥에 티라고 할까.
3429,5,돌에도 피가 돈다.
3430,5,그러나 이태원 셋집에도 순금이는 없었다.
3431,5,"앞문엔 호랑이가 있단다.
3432,5,전립선은 방광의 밑바닥에 있다.
3433,5,순자도 내 곁에 함께 누웠다.
3434,5,현관 안쪽에 심규태의 모습이 어른거렸다.
3435,5,그러나 옥에도 티가 있다고 했다.
3436,5,새 술은 새 부대에 담아야 한다.
3437,5,그 방에는 창문이 둘 있어.
3438,5,"가족도 집에 안 계십니다.
3439,5,그 당시 야구 점수판은 주자 뒤에 있었다.
3440,5,단집 옆에 뚝딱뚝딱 유리집 한 채를 지었다.
3441,5,그녀의 눈에 금세 눈물이 가득 고였다.
3442,5,그들은 지금 어디에 있는가.
3443,5,"며칠 전 산에는 눈이 내렸지요.
3444,5,현순의 눈앞에 수한의 얼굴이 다가왔다.
3445,5,그러나 거기에는 아무도 없었다.
3446,5,진실과 진리의 대학에 들어갈 차례다.
3447,5,박물관에 꼭 들어가야 할 문화재다.
3448,5,용천뱅이의 입가에 미소가 떠올랐다.
3449,5,흘러내린 피가 마룻바닥에 흥건했다.
3450,5,한반도 물 끝에 살고 있는 사람들.
3451,5,"내 사랑 한반도에 전교조 물결쳐라!
3452,5,"기어코 서울에도 말뚝을 박았구나.
3453,5,"이 집에 잉태의 기운이 있군요."
3454,5,"그 사람 집은 저 위쪽에 있어요."
3455,5,크래커에 버터나 크림 치즈를 바른다.
3456,5,아버지의 모습은 어디에도 없었다.
3457,5,옆에 앉으셨던 어머님은
3458,5,드라마는 극장에 얼마든지 있다.
3459,5,그런데 사무실에는 아무도 없었다.
3460,5,그들은 볏짚단 위에 펄썩펄썩 주저앉았다.
3461,5,순천시 전라남도 남동부의 여수반도 어귀에 있는 시.
3462,5,오줌은 발치께에 떨어졌다.
3463,5,"물에 들어가는 순간 암흑천지입니다.
3464,5,한강에 물고기가 돌아오고 있다.
3465,5,무덤은 밭가에 있었다.
3466,5,저쪽에 의자 하나 있지?"
3467,5,건물 안에는 사람이라곤 없었다.
3468,5,그리고는 손가락을 벌떼 속에 여기저기 집어넣는다.
3469,5,(문지방에 걸터앉는다.)
3470,5,청사 앞 아스팔트에는 아지랑이조차 피어오르지 않는다.
3471,5,- 남자의 꼬추가 여자 몸 속에 들어간대.
3472,5,KBS에는 일괄 사직서 제출 지시가 있었다.
3473,5,"이곳에도 물이 흘렀어요.
3474,5,마침 진열대에 초콜릿 상자가 놓여 있었다.
3475,5,"집안에 수상한 사람은 없습니까?"
3476,5,경찰서에는 기자들로 북적댔다.
3477,5,"약국엔 뭐 하러?"
3478,5,그때 노상에는 아무도 보이지 않았다.
3479,5,우리나라에는 그런 데가 없다.
3480,5,자리에 앉으세요 다비 씨.
3481,5,현주야 어디에 있니?
3482,5,농촌에도 바나나 풍년이 든 셈이다.
3483,5,안전 지대는 어디에도 없다.
3484,5,[쥔 어른께서는 집에 안 계신가요?]
3485,5,니나 얼굴에 활짝 웃음이 피었다.
3486,5,그 뒤에 권상무가 서 있었다.
3487,5,순금이는 한남동 판자촌에 살고 있었다.
3488,5,노동 현장에 산별노조 바람이 불고 있다.
3489,5,그녀는 수화기를 전화기 위에 올려놓았다.
3490,5,"교통사고를 당해서…… 병원에……"
3491,5,내일은 저 산 아래 마을에 장이 선다.
3492,5,교도소 안에는 회오리바람이 자주 일었다.
3493,5,광주시 북구 풍향동 서방시장에 있는 나성나염.
3494,5,그렇지만 비트겐슈타인은 그 대학에 오래 머물지 못한다.
3495,5,"만주엔 누가 가 있나?"
3496,5,"용상골에 사세요?"
3497,5,영구는 콩밭 골에 가만히 드러누웠다.
3498,5,그런데 임산부는 자기 속에 남을 품는다.
3499,5,수평선은 너무나 아득한 곳에 있었다.
3500,5,그녀는 자기 무릎 위에 얼굴을 올려놓았다.
3501,5,아니 그 곳에 씌어 있는 구절.
3502,5,우린 저 산 속 용마을에 삽니다."
3503,5,과자가 접시에 담겨 있었다.
3504,5,526 번은 단전에 힘을 주었다.
3505,5,"대구에 거의 머물고 있습니다.
3506,5,송파구 가락본동에 사는 한은숙 씨의 글입니다.
3507,5,전남 화순 증조산 기슭에 자리잡고 있는 쌍봉사.
3508,5,수각(水閣)은 공양간 뒤란에 있었다.
3509,5,신비의 힘이 그 안에 들어 있다.
3510,5,엘리베이터 안에 종이가 붙어 있다.
3511,5,"성 부근에 인가가 있어요?"
3512,5,"우리나라에는 왜 그런 화가가 없지?"
3513,5,배가 부산 부두에 닿았을 때다.
3514,5,방안엔 온기가 없었다.
3515,5,아이들은 집안에 없었습니다.
3516,5,벌에는 군데군데 사람들이 있었다.
3517,5,섬의 벼랑 위에는 아무도 없습니다.
3518,5,다비는 혼자 여자 분장실에 남아 있었다.
3519,5,"그냥 집에 있겠습니다.
3520,5,아내는 여기 욕실에 있다.
3521,5,안산에 산다던가.
3522,5,바닥에 앉읍시다!
3523,5,어머니는 공장에 7년이나 다니셨다.
3524,5,너희 나라에도 군인들 많잖아.
3525,5,동양엔 黃河 黃海가 있고……"
3526,5,남수는 그녀의 어깨에 손을 얹었다.
3527,5,신림동 안국동 무악동 가리봉동에 살았다.
3528,5,대체 호길은 어디에 있을까.
3529,5,모눈종이 위에 좌표를 정한다.
3530,5,식권에 이름과 날짜를 적었다.
3531,5,또한 무등산에는 원효사(元曉寺)가 있다.
3532,5,배는 흰색이고 옆구리에 줄무늬가 있다.
3533,5,개성 2 경기도 북서부에 있는 시.
3534,5,그가 첫 페이지 첫째 줄에 쓴 문장.
3535,5,바깥꼬리깃의 끝에는 황색 반문이 있다.
3536,5,텍스트 바깥에는 아무것도 없다.
3537,5,나는 조심스레 아저씨의 책상 앞에 섰다.
3538,5,그들의 눈가에는 물기가 어렸다.
3539,5,여기에 감이 있습니다."라고
3540,5,약수터에도 사람들이 안 보인다.
3541,5,그러면 하늘에 가득 별만 떠오른다네.
3542,5,카이로의 나일강가에는 파피루스 박물관이 있습니다.
3543,5,마을 가운데에 학교가 있어서 방문하였다.
3544,5,아내는 거실 저편에 서 있었다.
3545,5,그 옆에는 할머니가 서 계셨습니다.
3546,5,그리고 거기에 얼굴을 묻었다.
3547,5,가슴에 콧수건도 안 찬다.
3548,5,김문태가 거기에 가 있다.
3549,5,창밖엔 비가 내린다.
3550,5,"여기 지하실에 있네."
3551,5,"… 방에 있어요?"
3552,5,남천에는 순미가 있다.
3553,5,삽교읍 충청남도 예산군 서부에 있는 읍.
3554,5,2) 강원도 원성군 부론면 법천리 명봉산에 있던 절.
3555,5,"아버지 이 산에 있어?"
3556,5,예찬 일변도의 근원이 여기에 있다.
3557,5,월미섬 이마빡에 둘러붙은 군바리들 술이라네.
3558,5,그대는 또 어디에 있는가.
3559,5,"너도 빨리 물에 들어가고 싶지?"
3560,5,사랑하는 친구들이 다 그곳에 있다.
3561,5,안에 누구 계세요?"
3562,5,등줄기와 이마에 땀이 서렸다.
3563,5,서울대에는 영화학과가 없다.
3564,5,그 밑에 똥을 싸고."
3565,5,나는 그 물가에 앉는다.
3566,5,그 마을에는 할머니가 살고 계셨다.
3567,5,벌써 회사에 몸 담으신 지 20년.
3568,5,아이들 방에는 띠 벽지가 좋다.
3569,5,"이제 꿈에 너의 아버지를 만났구나.
3570,5,삼수 함경남도의 삼수군에 있는 지명.
3571,5,"턱에 수염이 많으니까."
3572,5,숟가락은 숭늉 그릇에 담아 둔다.
3573,5,바이어가 담배를 입에 물었다.
3574,5,네 속에도? "그럼 됐어.
3575,5,"나? 화장실에 있었지."
3576,5,택시 안에서 그는 생각에 잠긴다.
3577,5,호주머니엔 거즈 손수건도 넣어두고.
3578,5,집안에 불이 켜지고.
3579,5,흑백사진에 담긴 유년.
3580,5,이 세상에 이런 행성이 있는 걸까?
3581,5,일찍이 인도에 한 선각자가 있었다.
3582,5,등골에 식은땀이 흘렀다.
3583,5,베르사유 궁전 프랑스 베르사유에 있는 궁전.
3584,5,솔밭 속에 무덤들이 듬성듬성 있었다.
3585,5,마룻바닥에 누였다.
3586,5,서울에 있을 때였다.
3587,5,연이는 그만 눈에 눈물이 글썽거렸다.
3588,5,한강엔 밤이 내려 있었다.
3589,5,강화도에 살고 있었다.
3590,5,산에는 밤나무들이 많았습니다.
3591,5,"내가 그라운드에 있었더라면."
3592,5,티베트 중국 남 서부에 있는 티베트족의 자치구.
