Index,Label,Sentence
0,0,포화 상태에 있는 용액을 말한다.
1,0,금발 생머리에 푸른 눈.
2,0,그 지위에는 오르고 싶은 일이다.
3,0,"영원한 진리는 신선미에 있거든요.
4,0,무엇보다 가짜배기 감정에 젖지 말 것.
5,0,"곧 촬영에 들어간다.
6,0,2년 후 수양대군은 왕위에 오른다.
7,0,수포에 돌아가리다.
8,0,아이들은 다시금 두려움에 떨기 시작했다.
9,0,이 무렵 아내가 심장병에 걸렸다.
10,0,아침 햇살에 규혁은 잠에서 깨어났다.
11,0,이젠 실전에 들어갔다.
12,0,"미군부대 이전운동에 다시 나서야지요.
13,0,이별에 앞서 포옹이라도 하려는 연인 사이처럼.
14,0,우리 식구는 한참 동안 슬픔에 싸였다.
15,0,소형으로 암갈색에 조밀한 가로무늬가 있다.
16,0,장발에 떡 벌어진 어깨.
17,0,선관위는 결국 일반 투표함부터 개표에 들어갔다.
18,0,연극마저도 그런 위기 상황에 처해 있다.
19,0,며칠째 나는 불면에 시달렸다.
20,0,위험 속에 노출되어 비틀대는 것이다.
21,0,수호도 겁에 질려 있고…."
22,0,모든 언설은 다만 거짓 이름에 지나지 않는다.
23,0,잠결에 얼핏 본 그 사람이었다.
24,0,션은 복수에 나선다.
25,0,따라서 현실에 안주하려는 경향이 짙다.
26,0,“당장 굶을 판에….”
27,0,박창길은 조합에 없었다.
28,0,그런데 내가 매너리즘에 빠진 것일까?
29,0,보름달에 가까웠다.
30,0,송사리떼임에 틀림없다.
31,0,추위 속에 추워하자.
32,0,그녀는 오랜 침묵에 잠겨 있다.
33,0,나는 사랑의 보편성에 매달렸다.
34,0,침묵에 영 죽을 맛이다.
35,0,지회장에는 이종성 형님이 뽑혔다.
36,0,그 경우 펌프실 내부가 혼란에 빠진다.
37,0,젖이 부족하면 변비에 걸린다.
38,0,하지만 형은 언제나 희망에 넘쳐 있었다.
39,0,무사단내에도 계층이 있다.
40,0,이중고에 시달리는 LG다.
41,0,A와 결혼하는 것에 대하여.
42,0,등은 갈색에 검은색 줄무늬가 있다.
43,0,모비스는 5연패의 늪에 빠졌다.
44,0,배는 흰색에 흑갈색 줄무늬가 있다.
45,0,가난에 찌들어버렸어.
46,0,치열한 경쟁 속에 하루를 다투며
47,0,설악산도 비슷한 위기에 처해 있다.
48,0,우린 지금 집단 히스테리에 걸려 있소.
49,0,재고는 언제나 0에 가까웠다.
50,0,호나우두는 8골로 대회 득점왕에 올랐다.
51,0,<12>감기에 잘 걸린다.
52,0,부인과 별거 상태에 있다.
53,0,"꼴에 장개는 가고 싶었어?"
54,0,류씨는 잠시 그런 회의감에 젖었다.
55,0,우리는 유엔과 각별한 관계에 있다.
56,0,각급 학교들이 방학에 들어갔다.
57,0,고민에 빠졌다.
58,0,감동에 젖는다.
59,0,문학은 독자의 심리 상태에 영향을 준다.
60,0,이 추위에 풀들은 잘 자라고 있을까.
61,0,갈증에 더더욱 좋다.
62,0,훈아는 갑자기 무섬증에 휩싸이기 시작했다.
63,0,심한 공복시에도 마찬가지다.
64,0,하지만 무심결에 흘려버린 물 역시 돈!
65,0,2학년에 막 올라가서였다.
66,0,먼저 연예인 섭외에 들어갔다.
67,0,매너리즘에 빠진 걸까.
68,0,극한 위기 속에 억지로 먹는 알약이다.
69,0,우리 사회는 지금 과도기에 있다.
70,0,나는 조금 이상한 감정에 사로잡혔다.
71,0,그 주제에 다른 여자한테로 눈길을 돌리다니.
72,0,단순히 생활에 여유가 생겼기 때문일까.
73,0,이어 백악관도 비상에 들어갔다.
74,0,서울지하철공사 노조가 7일 오전 부분파업에 들어간다.
75,0,이드는 보통 때는 무의식 속에 있다.
76,0,다음날부터 동생과 난 개구리잡이에 나섰다.
77,0,저녁식사 후 뒤풀이에 들어갔다.
78,0,그 때부터 남성은 배신감에 빠진다.
79,0,마치 어둠에 던져진 효철의 마음처럼.
80,0,작품의 화랑 배치가 맘에 안 든다.
81,0,그리고 이제 그녀는 폐경기에 들어섰다.
82,0,아마 회의에 빠져 있을 것이다.
83,0,그러나 나는 더욱더 혼란에 빠져들었다.
84,0,긴장감에 어깨숨을 조심스럽게 내쉬었습니다.
85,0,동현의 혀는 취기에 휘말려 있었다.
86,0,얼마나 단잠에 빠졌을까.
87,0,이런 생각으로 나는 단식단 활동에 들어갔다.
88,0,어머니는 배신감에 몸을 떨었다.
89,0,감기에도 약은 잘 먹지 않는다.’
90,0,가위에 눌린 것인가.
91,0,내가 마음에 드는 시를 말야.
92,0,무아경에 이른다.
93,0,➎ 부부생활에 거부감이 생긴다.
94,0,우리는 공황상태에 빠졌어.
95,0,그녀의 방 역시 어둠에 잠겨 있다.
96,0,백악관도 긴장감에 휩싸여 있다.
97,0,"그 마음에 질렸어!"
98,0,있었음에 분명하다.
99,0,품이도 곰곰 생각에 잠겼습니다.
100,0,"인간은 갈대에 지나지 않는다.
101,0,“남의 집 살이 하는 주제에….”
102,0,"경지 씨 사랑에 빠졌구나."
103,0,내가 양심선언하고 단식에 들어가겠어."
104,0,등은 밤색에 검은색 줄무늬가 있다.
105,0,그런데 그 자리에 내가 빠진다니.
106,0,하지만 거기에 그치지 않아야 한다.
107,0,교사는 거기에 약간만 지도하면 된다.
108,0,그 모순 속에 찢겨지는 존재다.
109,0,정당들도 네티즌 공략에 나섰다.
110,0,그녀와 대등한 위치에 달해야 한다.
111,0,등은 올리브 갈색에 암색 줄무늬가 있다.
112,0,이 사업은 분명 정보산업의 핵심에 속한다.
113,0,자네는 왜 튀김 국수에 새우 튀김을 쓰는가.
114,0,불에 기름을 붓는 꼴이었다.
115,0,사람들은 또 혼란에 빠졌다.
116,0,나도 세상살이에 고수가 되고 싶었다.
117,0,키스에 응하며 그녀가 말했다.
118,0,생각에 잠기는 모양입니다.
119,0,열심히 공부하면서 일에 임하겠어요"
120,0,◇서쪽의 개운함에 빠진 홍순정씨
121,0,아빠는 무언가 생각에 잠기십니다.
122,0,만화는 아동 정서에 도움이 된다.
123,0,얼결에 전두성이라고 작명을 했다.
124,0,바칼로레아의 논제는 화두(話頭)에 가깝다.
125,0,우리나라 산업발전에도 도움이 되겠지요.
126,0,자본주의에 첫발을 내디딘 헝가리.
127,0,서스럼없는 사이에
128,0,컴퓨터 프로그램은 그 제작에 비용이 많이 든다.
129,0,윤리의 본질은 자율성에 있다.
130,0,경창종합학교 동료들은 수술비 모금 운동에 나섰다.
131,0,그러나 그것은 다만 생각에 그쳤다.
132,0,그 열쇠는 상승 효과에 있다.
133,0,칼은 그러나 도구에 그치지 않는다.
134,0,"세진 씨 상상에 맡기겠습니다."
135,0,그는 저를 얼결에 안아버렸습니다.
136,0,수비 모두 열세인 마당에 정공법은 어렵다.
137,0,여자 콤플렉스에 빠져 있다.
138,0,잠결에 보고는
139,0,지 주제에 별수 있간."
140,0,"훈련에 방해받을까 봐요.
141,0,흰 살갗에 구멍새들이 큼직큼직했다.
142,0,남편의 목소리에 잔뜩 화가 나 있다.
143,0,나는 초저녁부터 잠에 빠져 버렸다.
144,0,당뇨병은 그 증상에도 여러 가지가 있다.
145,0,그 편안함은 어둠에 지나지 않는다.
146,0,품이는 이리저리 궁리에 빠졌습니다.
147,0,발음은 '훼'에 가깝다.
148,0,한마디로 미혹에 빠진 거지.
149,0,지금은 힘에 겹고 인기도 하락.
150,0,그래서 공항 풍속에도 한참 어둡다.
151,0,이 근방이라고 단정하기엔 뭣합니다.
152,0,그는 12월말부터 전국 순회공연에 들어간다.
153,0,드디어 여행길에 올랐다.
154,0,첫발은 얼결에 쏘았대.
155,0,부안중학교도 아침부터 활기에 넘쳐 있었다.
156,0,가끔 지수는 그런 생각에 잠긴다.
157,0,불황국면에 빠져들었다.
158,0,그러나 아직 만족하기에는 일렀다.
159,0,예술은 감각세계보다 일자에 더 가깝다.
160,0,아직 해는 중천에 걸려 있다.
161,0,정금은 골똘히 생각에 잠기는 눈치였다.
162,0,남자는 또 눈앞의 현실에 약하다.
163,0,서연이야말로 잠결에 홀린 듯했다.
164,0,건석은 얼떨결에 봉지를 열었다.
165,0,노이로제 또는 과대망상 또는 정신병에 걸린다.
166,0,"마음에 안 든 모양이구나."
167,0,나는 주어진 생활에 너무 익숙하다.
168,0,병신인 주제에 돈을 훔쳐?"
169,0,"담배도 못 피우는 주제에 개새끼.
170,0,·자기 꾀에 빠진 말
171,0,자탄속에 한 해가 저문다.
172,0,자기 기만에 빠져 있다.
173,0,오랜 시어머니 병치레에도 불평 한번 없었다.
174,0,엉뚱한 소용돌이에 휘말리는 기분이었다.
175,0,그때마다 상담교사의 연민에 젖은 목소리.
176,0,밤이면 악몽에 시달렸다.
177,0,술과 관능에 절은 밤공기.
178,0,오히려 수학적 직관에 가까운 거지.
179,0,더구나 한국의 기업은 세무사찰에 약하다.
180,0,가족은 주부의 음식솜씨에 길들여진다.
181,0,시민들은 오로지 현실에 급할 뿐이다.
182,0,달러에 달한다.
183,0,그러나 이는 그녀의 겸손에 지나지 않는다.
184,0,참으로 마음에 꼬옥 드는 말이다.
185,0,그 날밤 우리는 우연히 근무편성조에 들었다.
186,0,다행히 나는 상위권에 속했다.
187,0,데뷔하자마자 정상에 올랐다.
188,0,바이러스에 걸린 난은 구제불능이다.
189,0,나와 꼭같은 마음이었기에.
190,0,그런 태도가 맘에 들었다네.
191,0,더구나 셋방(貰房)으로 돌아다니는 터에!
192,0,언어의 불감증에 걸린 것이다.
193,0,내가 보는 세계 또한 허깨비에 불과하다.
194,0,자 콤플렉스에 빠져 있다.
195,1,그러나 적막에 서린 저 고뇌.
196,1,황산 질산 수산화칼륨에 녹는다.
197,1,말에 짓밟힌 부상 때문이 아니었다.
198,1,입김에도 모빌은 제법 움직였다.
199,1,나도 뭐에 씌었지.
200,1,"아니 랍스터에 찔렸어."
201,1,그는 망연자실 도깨비에 홀린 듯.
202,1,등은 금세 땀에 젖는다.
203,1,플루오르화수소에 의하여 분해된다.
204,1,그의 뒷모습은 금방 어둠에 묻혔다.
205,1,"서쪽 바다가 비에 젖고 있대."
206,1,불빛에 살펴보니 태봉이었다.
207,1,제선왕도 맹자의 말에 말려들었습니다.
208,1,▼베일에 쌓인 바이롬사▼
209,1,온몸이 금세 비에 젖었다.
210,1,"채석장서 일허다 돌에 짓쪄습니다."
211,1,덫에 앞발을 찌긴 것이었다.
212,1,번데기들이 핏물에 잠기고 있었다.
213,1,"그럼 불에 태워버릴까?"
214,1,주위는 완전히 어둠에 묻혔다.
215,1,현대사회는 공해와 스트레스에 휩싸여 있다.
216,1,비누방울에 반사되어 무지개를 만들던 햇살.
217,1,이들은 모두 투표에 의해 선출된다.
218,1,그의 품에 안긴 채로.
219,1,밑실이 반달에 감겼을 때 2.
220,1,바람에 찢겨
221,1,나는 초대장의 명령에 휘둘리고 있었다.
222,1,아저씨 눈물이 달빛에 방울방울 보였습니다.
223,1,"미국의 대통령 케네디가 총에 맞았습니다.
224,1,그러면 바퀴에 콱 치이고 말지.
225,1,먹구름에 싸인 물욕의 폐허.
226,1,손에 붙잡히기도 한다.
227,1,이 장면이 카메라에 잡혔다.
228,1,"개가 덫에 찡겼다."
229,1,감자 감자도 신문지에 싸서 보관.
230,1,"밤새 당신 꿈에 시달렸어요.
231,1,내 총에 맞은 거야.」
232,1,새롬이는 산딸기를 풀줄기에 꿰었습니다.
233,1,그건 벌써 땀에 젖어 있었다.
234,1,그것들을 보자기에 쌌다.
235,1,양초에 불을 붙인다.
236,1,"칼에 베었어?"
237,1,그녀는 그런 맛에 산다.
238,1,바람결에 꽃향내가 날아왔다.
239,1,낙엽이 불길에 사그러드는 냄새 때문일까?
240,1,대신 러이도 징을 손에 잡았다.
241,1,헛발질 때문에 지워지는 출발선.
242,1,그리고 금속버클 부분을 오른손에 힘껏 쥐었습니다.
243,1,비닐 봉투나 지퍼백 등에 넣어 냉동한다.
244,1,온동네는 아득한 매향에 휩싸인다.
245,1,"우리의 몸은 소금에 녹슨다."
246,1,그들은 그 향기에 취해 있었다.
247,1,비난에 시달려야 했다.
248,1,웃음을 두려워하는 자의 손에 말이다.
249,1,총에 맞은 것이지요.
250,1,곰이는 아저씨의 손을 양손에 잡았습니다.
251,1,'산채'; 들기름에 무친 14가지 나물반찬
252,1,두환은 총에 맞았다.
253,1,"그것 무엇에 쓰게?"
254,1,그래서 그는 절대 말에 넘어가지 않는다.
255,1,"그 새끼 엄살에 넘어가지 말어.
256,1,"화학농법에 다 죽는다.
257,1,총에 맞았습니다.)"
258,2,"전 이 대학에 가고 싶습니다."
259,2,"등허리에 붙었어요."
260,2,그보다 오늘 저녁 모임에 조금 늦겠어요.
261,2,언덕 꼭대기 외딴 구멍가게에 닿았습니다.
262,2,류씨는 허탈감에 빠졌다.
263,2,9층에 다다른 것이었다.
264,2,반대로 LG는 벼랑에 몰렸다.
265,2,흰색 초 여러 개를 욕조 테두리에 올려놓았다.
266,2,끝섬에 가서 자살하겠다는 미애의 고백.
267,2,"저기 납골당에 모신답니다."
268,2,반야원에 갔어.
269,2,나는 교사휴양원엘 가려고 합니다.
270,2,그러면 또다시 책장에 꽂혀버린다.
271,2,우리는 지금 CI의 시대에 와 있다.
272,2,오늘은 원장 2구에 갔다.
273,2,이 놀이터에 참 오고 싶었어."
274,2,"저네 집에 아주 갔어요."
275,2,그러나 선생님은 첨벙 물에 엎어졌습니다.
276,2,이윽고 버스는 바닷가에 닿았다.
277,2,춘기의 말은 이치에 닿았다.
278,2,조금 전 문방구엘 다녀왔습니다.
279,2,그래서 자리에 누웠다.
280,2,그래서 사범대에 들어왔다.
281,2,떡국이나 칼국수 찌개에 살짝 고명으로 올려놓는다.
282,2,이윽고 약수터에 다다랐습니다.
283,2,"어? 너네 집에 갔구나!"
284,2,누군가 학교에 신문을 가져왔다.
285,2,인생에 여유를 가져다 주죠.
286,2,"야 우리 산꼭대기에 안 갈래?"
287,2,전 본교에나 다녀올까 합니다.
288,2,일본에 가봐 이년들아!
289,2,해외 풍토병이 국내에 스며든다고 한다.
290,2,얼른 버스에 오르고 만다.
291,2,-술집에도 자주 가시는지요.
292,2,그 강물 속에 당신과 내가 떠갑니다.
293,2,어디엘 가 있을까.
294,2,얼마 전 고향엘 다녀왔다네.
295,2,물품은 중국음식에 필수적으로 들어가는 숙주나물.
296,2,"반야원에 가실라구요?"
297,2,다시는 밖에 나가지 않겠습니다."하고
298,2,아마 목적지에 다다른 모양이었다.
299,2,그래서 경화는 단도직입으로 본론에 들어갔다.
300,2,공원에 가요.
301,2,아이도 남편도 눈에 들어오지 않았어요.
302,2,주머니에 주민등록증이 있었거든요.
303,2,저녁 차로 대구에 갔다.
304,2,마을 어귀에 이르러 있었다.
305,2,재수하여 본교에 옴.
306,2,아이는 혜미 집에 가지 않았다.
307,2,나는 한 아이의 집에 가서
308,2,"언니 나무에 올라가자."
309,2,서부극을 상영하는 극장엘 가자.
310,2,그는 유리창에 바짝 다가섰다.
311,2,가르시아는 그 열차에 올랐다.
312,2,[손님 방에 가봐라.]
313,2,마침내 땅에 떨어진다.
314,2,한상철 번역)로 무대에 올렸다.
315,2,아내가 책장에 꽂아버린 것이다.
316,2,차돌이도 엄마 저고리에 얼굴을 기대었습니다.
317,2,고향 들녘 黃小芝 식탁에 봄나물을 올린다.
318,2,마침내 그가 나를 풀밭 위에 내팽개쳤다.
319,2,「사랑방엘랑 나가지 마라……」
320,2,속셈학원에 보내세요."
321,2,난 따뜻한 방에 들어가면…"
322,2,-그럼 그애 집에 한번 가볼까?
323,2,괜히 이곳에 왔구나 싶다.
324,2,수창이는 말없이 신문을 탁자 위에 던졌다.
325,2,그러다가 대학에 들어오면 훨씬 자유로워진다.
326,2,이윽고 차는 호텔 앞에 닿았다.
327,2,마침내 그는 상자에 푹 거꾸러졌다.
328,2,시골에 가자.
329,2,나는 술잔을 탁자에 올려놓았다.
330,2,"내일 그만 경성에나 갈까? "
331,2,아래층의 시멘트 바닥에 창길을 내동댕이쳤다.
332,2,일행이 마침내 절벽 끝에 이르렀다.
333,2,그 자세로 '작가 탐방'에 들어가자.
334,2,저는 그의 어깨에 이마를 댔습니다.
335,2,중년 사내가 호주머니에 손을 찔렀다.
336,2,아기는 연탄을 언덕길에 내려놓았습니다.
337,2,그럼 서대문엔 가나?
338,2,"투표장에 들어갑니다."
339,2,누구 두 사람은 다른 크로스에 가보고.
340,2,그래서 나는 너를 제자리에 뉘었단다.
341,2,"어제 이 도시에 왔어요.
342,2,집에 돌아오면 언필칭이 원고 타령이다.
343,2,모스크바에서 기차로 레닌그라드에 내렸다.
344,2,"영국에 갔다고?"
345,2,'난 어느 공장에 팔려 가나?'
346,2,다리를 방바닥에 쿵쿵 드놓았다.
347,2,나도 올해는 대학에 꼭 들어가고 싶어.
348,2,너트를 황산마그네슘 용액 병에 하나씩 넣는다.
349,2,그러면 벌이 몇 마리 손에 올라앉는다.
350,2,"춘기가 총학생회에 부치지.
351,2,짝귀가 단상에 올라 연설했다.
352,2,인간 세상에 다시 나가라.
353,2,호상이는 공장에 들어가겠다고 말했다.
354,2,내일은 병원에를 가야지!
355,2,덕호는 담배 꼬투리를 재털이에 팽개치며
356,2,도인도 병원엘 가나요?」
357,2,그 섬엘 들어가 볼 생각이지.
358,2,어느 중년부인이 안경점에 들렀다.
359,2,자주 아버지 무덤에 와봐야지.
360,2,그러면 선비가 방적공장에 다니는가?
361,2,방바닥에 주저앉았습니다.
362,2,300환을 바지 호주머니에 넣었습니다.
363,2,6시간쯤 걸려 뚜르크에 도착했다.
364,2,그리고 그 위에 손을 대어보았다.
365,2,새벽차로 대구에 갔다.
366,2,"그럼 우리 집에 가자."
367,2,위협 사격과 함께 방송국에 뛰어들었다.
368,2,나는 민석이와 나란히 교실에 들어섰다.
369,2,우선 이곳 분교장 육성회장네 집에 들었어.
370,2,이층에 빨리 올라가봐라.
371,2,세진은 얼른 이어폰을 귀에 꽂았다.
372,2,몰래 산부인과엘 찾아갔다.
373,2,저 방에 좀 들어가 보시라니까요?
374,2,군대에 갔어요.
375,2,"고향엘 좀 가다가……"하고
376,2,(할머니의 어깨에 기댄다.)
377,2,둘은 사창가에도 함께 갔다.
378,2,"대천엘 가자구."
379,2,드디어 임금은 큰 집에 도착했습니다.
380,2,그리고 다시 침대에 누웠다.
381,2,그러나 러이의 머리는 바로 땅바닥에 박혔다.
382,2,이윤상군 가족 품에 돌아와!
383,2,학교에 가려고."
384,2,당신은 이제 막 프놈펜에 들어섰다.
385,2,아이는 아낙의 가슴에 얼굴을 묻었다.
386,2,"광주에 내려가는 거지요?"
387,2,벌도 그곳에 돌아온다.
388,2,이틀 후 나는 경부선 기차에 올랐다.
389,2,"집에 언제 갈 거여?"
390,2,그러면 또 병원에 가야 해."
391,2,그가 성경과 담뱃갑을 방바닥에 동댕이쳤다.
392,2,가르시아는 힘없이 소파에 주저앉았다.
393,2,섹스 스캔들의 도마위에 올랐다.
394,2,아이는 학교에 들어갔을까?
395,2,"할머니랑 절에 가."
396,2,모처럼 집에 들어왔는데.]
397,2,그래서 고향에 가자.'
398,2,나비는 정신없이 꽃 위에 내려앉았습니다.
399,2,차가 브라운 씨의 관사 앞에 닿았다.
400,2,"그곳에 나가 있으마."
401,2,"저 자식 또 비명에 가겠군."
402,2,또 염라대왕 앞에 올 수밖에.
403,2,어서 배에 오르십시오.
404,2,나는 집에 와서 생각했다.
405,2,해는 벌써 선창머리에 올라와 있었다.
406,2,"나하고 학교에 가."
407,2,학교에 갔다.
408,2,그리고 길바닥에 칼을 버렸다.
409,2,댐에 도착하자 몹시 숨이 찼다.
410,2,"아마 고아원에 들어갔겠지."
411,2,찻집에 들어서자마자부터였다.
412,2,학교에 다니지?」
413,2,"아버지 괜히 장에 가셨지?"
414,2,갈림길에 왔다.
415,2,천영감이 단상에 올라가 말했다.
416,2,나는 진외가에 심부름을 자주 갔었다.
417,2,그래서 땅에 묻는 것이다.
418,2,오후 6시30분쯤 기자실에 들렀다.
419,2,구청이나 시청에 들어가 보라.
420,2,똘배는 어저께의 시궁창에 돌아와 있었습니다.
421,2,언제 한 번 학교에 갈께요.
422,2,그의 품속에 얼굴을 묻은 채 그녀는
423,2,넷은 후다닥 차 안에 올라탔다.
424,2,"예 엄마와 목욕탕에 갔었어요.
425,2,"저는 이 찻간에 탔습니다."
426,2,"왜 또 한국은 이라크에 가나?"
427,2,'그는 용산역에 내렸다.
428,2,나는 잠시 바닥에 눕는다.
429,2,"나 그냥 집에 가는데요?"
430,2,오늘 유경이가 또 학교에 따라왔다.
431,2,마포구 망원동 한강 시민공원에 이르는 주택가 골목길.
432,2,저도 지금 학교에 가는 길입니다.」
433,2,작년 운동회 때 학교에 구경 오셨어."
434,2,벼룩시장에 한번 들러보자구!
435,2,"공안국에 갔었어."
436,2,이웃에 놀러 가시는 모양이었다.
437,2,"행정실엔 들렀나요?"
438,2,경축 대회에 늦겠다.
439,2,아빠가 외국에 자주 다니셨거든요.
440,2,형사는 방 문턱에 털썩 걸터앉았다.
441,2,아내 곁에 누웠다.
442,2,아버지 또 술집에 갔어!
443,2,국민학교에 다니는 소녀이다.
444,2,할머니 (밭둑에 털썩 앉으며) 후유!
445,2,우리 엄마는 학교에 잘 안오신다.
446,2,그 후 우린 그 집엘 자주 들른다.
447,2,먼저 무대에 오른 후보는 김정연.
448,2,어쨌든 나는 그날 투표장에 나갔다.
449,2,유열 신효범 조규찬이 함께 발렌타인데이 콘서트 무대에 선다.
450,2,군청에 다다랐다.
451,2,나는 옥수수 밭두렁에 그만 누워 버렸다.
452,2,학교에 들어가니 벌써 수업이 시작되었다.
453,2,화실엘 갈 참이었다.
454,2,뚱쇠는 무시무시 입에 넣었다.
455,2,예술에 창작의 자유를 가져다 주었으니까요.
456,2,모처럼 처가에 다녀오는 길이었다.
457,2,우리 아버지께서는 탄광에 다니십니다.
458,2,"우리 아버지는 회사에 다니세요."
459,2,당장 산에 가자."
460,2,영순이는 우리집에 자주 드나들었다.
461,2,"언론에 흘린다?" "예.
462,2,초밭 할머니는 자리에 몸져누웠습니다.
463,2,나는 꼭 집에 가야 합니다.
464,2,고갯길에 다다랐다.
465,2,집에 다녀오는 길이었다.
466,2,어서 외양간에 가자."
467,2,여행의 마지막 장소인 파리에 들어갔다.
468,2,롱아일랜드 비치하우스에 가는 길이지?"
469,2,어머니가 마루에 주저앉아 탄식했다.
470,2,그 순간 시어머니가 사립문에 딱 들어섰다.
471,2,거기에라도 가시지.
472,2,"오늘 시골집에 가야 하는데."
473,2,"서울에는 왜 오셨소?"
474,2,동아시아의 시베리아에서 일본에 걸쳐 번식한다.
475,2,학생은 학교에 갔다.
476,2,나는 룡성 43호 초대소에 돌아왔다.
477,2,어쨌든 집에 가자.
478,2,새삼스러이 고향에는 왜 내려오려는 거야.
479,2,우리들은 정류장에 나갔다.
480,2,남수는 35노트 쾌속정에 몸을 실었다.
481,2,어느 사무실에 갖다줬어?
482,2,그리고 무릎 위에 우산을 놓는다.
483,2,"아버지 제가 장터 마을에 다녀올게요.
484,2,그냥 책에 눈을 박고 있었다.
485,2,김은 자리에 앉으며 현더러
486,2,"무엇보다 디지털 영화에 욕심이 났습니다.
487,2,그런데 이처럼 자네는 여기에 와 있구먼.
488,2,산소에 오셨습니꺼?"
489,2,"우물에 나가 봐!"
490,2,그래서 현장에 나가야 했다.
491,2,벌써 등에 척척한 땀이 배어났다.
492,2,"복덕방에 좀 가보지."
493,2,"가끔 이곳에 오곤 하지요.
494,2,"전 할머니 집에 가겠습니다.
495,2,학교에 갔습니다.
496,2,우리 친정에 가면 얼마나 사근사근한데.
497,2,자연에들 너무 돌아와 걱정이야."
498,2,집에 거의 다 와간다.
499,2,엄마는 저고리에 얼굴을 묻었습니다.
500,2,"종가에 간다.
501,2,"왜 국문과엘 갔죠?"
502,2,경북고등학교에 무시험 진학을 하였다.
503,2,엄마와 같이 밭에 갔다.
504,2,그래서 인천에 간 거였어.
505,2,오후 본교에 갔다.
506,2,동쪽 회랑에 들어서자 사방은 이미 어둑하다.
507,2,8시 차로 대구에 갔다.
508,2,"학교에 다녀왔습니다."
509,2,[남산에 가자니까….]
510,2,매일 아침 산에 같이 가니까.
511,2,그는 다시 침대에 누웠다.
512,2,난 다시 주인의 손에 되돌아왔다.
513,2,밭두덩에 올라서자 돌각담이다.
514,2,"여보 병원에 가 봅시다."
515,2,"나 사실 여기에 올 처지가 아니야.
516,2,교장실에 가 봤다.
517,2,희은은 한치를 방바닥에 패대기를 쳤다.
518,2,규혁은 소파에 그대로 주저앉았다.
519,2,-공장에 다니려고 했었어요.
520,2,또 초소에 갔었소?」
521,2,"샘골 단경이네 집에 가셨다.
522,2,"그리고 우리 집에 애 좀 보내.
523,2,사설학원에 다니는 학생은 소수다.
524,2,유치원에 다닐 때였다.
525,2,그곳에 가자.
526,2,방학해서 집에 가는거가."
527,2,대모벌은 그곳에 먹이를 내려놓는다.
528,2,"저 총각하고 교육청에 좀 갈려고요."
529,2,나는 빨리 과학실에 들어갔다.
530,2,-왜 공장에 가려고 했지?
531,2,영순이는 엉거주춤 다시 프레이저 옆에 앉았다.
532,2,아 왜 시청역엘 안 가?
533,2,작은아버지는 누나를 마루 위에 반듯이 눕혔다.
534,2,K는 소파에 앉았다.
535,2,분교장에 갖다 준단다.
